{
  "authorization_boundary": {
    "backtest_authorized": false,
    "data_acquisition_authorized": false,
    "deployment_authorized": false,
    "ledger_append_authorized": false,
    "measurement_authorized": false,
    "promotion_authorized": false,
    "statistics_authorized": false,
    "trading_authorized": false,
    "trial_creation_authorized": false
  },
  "candidate_budget": {
    "additional_valid_candidate_families_max": 18,
    "attempted_leads_max": 30,
    "cancel_if_valid_measurable_candidates_below": 18,
    "candidates_per_round_max": 6,
    "existing_v2_4_failed_candidate_families": 6,
    "hard_cancel_if_additional_valid_failures": 18,
    "round_count": 3,
    "total_measured_family_budget": 24
  },
  "candidate_scope": {
    "detail_timeframe": "15m",
    "dynamic_pairlist": false,
    "forward_fill": false,
    "main_timeframes": [
      "1h",
      "4h",
      "1d"
    ],
    "pairs": [
      "BTC/USDT:USDT",
      "ETH/USDT:USDT"
    ],
    "resampling": false,
    "settlement": "USDT",
    "source_family_count": 3,
    "source_rule_requirement": "Only deterministic, executable and license-compliant rule sources may enter the finite candidate budget; vague leads do not count as valid candidates.",
    "venue": "Bybit linear perpetuals"
  },
  "cpcv": {
    "embargo_days": 30,
    "fit_isolation": "fit transforms and selection logic on training data only",
    "group_assignment": "12 contiguous chronological development-window groups; no random shuffling",
    "minimum_training_observations": 60,
    "n_groups": 12,
    "path_count": 11,
    "path_pairings": [
      {
        "path_id": 0,
        "test_pairs": [
          [
            0,
            11
          ],
          [
            1,
            10
          ],
          [
            2,
            9
          ],
          [
            3,
            8
          ],
          [
            4,
            7
          ],
          [
            5,
            6
          ]
        ]
      },
      {
        "path_id": 1,
        "test_pairs": [
          [
            0,
            10
          ],
          [
            11,
            9
          ],
          [
            1,
            8
          ],
          [
            2,
            7
          ],
          [
            3,
            6
          ],
          [
            4,
            5
          ]
        ]
      },
      {
        "path_id": 2,
        "test_pairs": [
          [
            0,
            9
          ],
          [
            10,
            8
          ],
          [
            11,
            7
          ],
          [
            1,
            6
          ],
          [
            2,
            5
          ],
          [
            3,
            4
          ]
        ]
      },
      {
        "path_id": 3,
        "test_pairs": [
          [
            0,
            8
          ],
          [
            9,
            7
          ],
          [
            10,
            6
          ],
          [
            11,
            5
          ],
          [
            1,
            4
          ],
          [
            2,
            3
          ]
        ]
      },
      {
        "path_id": 4,
        "test_pairs": [
          [
            0,
            7
          ],
          [
            8,
            6
          ],
          [
            9,
            5
          ],
          [
            10,
            4
          ],
          [
            11,
            3
          ],
          [
            1,
            2
          ]
        ]
      },
      {
        "path_id": 5,
        "test_pairs": [
          [
            0,
            6
          ],
          [
            7,
            5
          ],
          [
            8,
            4
          ],
          [
            9,
            3
          ],
          [
            10,
            2
          ],
          [
            11,
            1
          ]
        ]
      },
      {
        "path_id": 6,
        "test_pairs": [
          [
            0,
            5
          ],
          [
            6,
            4
          ],
          [
            7,
            3
          ],
          [
            8,
            2
          ],
          [
            9,
            1
          ],
          [
            10,
            11
          ]
        ]
      },
      {
        "path_id": 7,
        "test_pairs": [
          [
            0,
            4
          ],
          [
            5,
            3
          ],
          [
            6,
            2
          ],
          [
            7,
            1
          ],
          [
            8,
            11
          ],
          [
            9,
            10
          ]
        ]
      },
      {
        "path_id": 8,
        "test_pairs": [
          [
            0,
            3
          ],
          [
            4,
            2
          ],
          [
            5,
            1
          ],
          [
            6,
            11
          ],
          [
            7,
            10
          ],
          [
            8,
            9
          ]
        ]
      },
      {
        "path_id": 9,
        "test_pairs": [
          [
            0,
            2
          ],
          [
            3,
            1
          ],
          [
            4,
            11
          ],
          [
            5,
            10
          ],
          [
            6,
            9
          ],
          [
            7,
            8
          ]
        ]
      },
      {
        "path_id": 10,
        "test_pairs": [
          [
            0,
            1
          ],
          [
            2,
            11
          ],
          [
            3,
            10
          ],
          [
            4,
            9
          ],
          [
            5,
            8
          ],
          [
            6,
            7
          ]
        ]
      }
    ],
    "protocol_id": "dsr_pbo_cpcv_v2_12x2",
    "purge_days": 30,
    "split_count": 66,
    "test_groups_per_split": 2,
    "zero_training_split_policy": "fail_closed; any split below minimum invalidates the package"
  },
  "current_state": {
    "deployment_allowed": false,
    "ledger_changed": false,
    "measurement_authorized": false,
    "measurement_ready": false,
    "promotion_allowed": false,
    "statistics_run": false,
    "trading_allowed": false,
    "trial_ids_created": false
  },
  "execution_cost_gate": {
    "base_fee_per_side": 0.00055,
    "engine": "Freqtrade pinned engine eb1a668ceb0f29b7d578156bfc24c45278c0c0f8",
    "engine_patch_allowed": false,
    "fee_sensitivity_ladder_per_side": [
      0.00055,
      0.00075,
      0.001
    ],
    "global_adverse_slippage_control_available": false,
    "limitation": "Pinned Freqtrade has no global fixed adverse-slippage control; slippage=0.0 is a measurement limitation and is not a claim of frictionless real execution.",
    "native_fee_control": "--fee",
    "price_modification_allowed": false,
    "return_postprocessing_allowed": false,
    "slippage_value": 0.0,
    "survivor_rule": "A survivor must pass the base native fee and every pre-declared fee sensitivity variant; no fee variant may be chosen after seeing results."
  },
  "holdout": {
    "development_end_utc": "2026-06-23T00:00:00Z",
    "end_exclusive_utc": "2026-08-22T00:00:00Z",
    "holdout_failure_policy": "candidate fails; no post-hoc repair using holdout",
    "minimum_observations": 60,
    "positive_after_cost_required": true,
    "selection_uses_holdout": false,
    "start_utc": "2026-06-23T00:00:00Z",
    "tuning_uses_holdout": false
  },
  "integrity_references": {
    "future_measurement_requires_new_authorization": true,
    "protected_files": [
      {
        "path": "strategy_discovery_v1/data/global_trial_ledger.json",
        "sha256": "1f51cb9b6c3e2d151d00054c9822cd0becf7b896bd406010f62ec585d388fae7"
      },
      {
        "path": "strategy_discovery_v1/second_collection_v1/data/engine_fidelity_measurement_freeze_package_v2_4.json",
        "sha256": "b13d502783ed0c58e460c2bffb783faaf8da0763d39ad79ba8783c6c0cfbacaf"
      },
      {
        "path": "strategy_discovery_v1/second_collection_v1/data/execution_assumption_manifest_v1_4_native_fee_only_frozen.json",
        "sha256": "1fbe398faac1a571817214e990149ebf3918f48a7f4c6c986757f69e2ce188ae"
      },
      {
        "path": "strategy_discovery_v1/second_collection_v1/data/freqtrade_batch_001_engine_native_v2_4/batch_manifest.json",
        "sha256": "6712c97072c8c3c34cd0e09faee439ce5d9f8f09617d1ef4b8c88ddc299d76e1"
      },
      {
        "path": "strategy_discovery_v1/second_collection_v1/data/freqtrade_batch_001_statistics_v2_4.json",
        "sha256": "d4299f96ba112a6e3a8c7be577a3e2278d38cb4d6fd44c9f0dfca7d9377fbfe6"
      },
      {
        "path": "strategy_discovery_v1/second_collection_v1/data/freqtrade_batch_001_statistical_manifest_v2_4.json",
        "sha256": "35ec9677b586d8c29f5d160d8682d67b7407a9c26d59e4a83f16b96b86e69038"
      },
      {
        "path": "strategy_discovery_v1/protocols/dsr_pbo_cpcv_v1.json",
        "sha256": "c45a37fe99a2d5a8407e8c889ead173b8626ef53748930d2f5970a272782070e"
      },
      {
        "path": "strategy_discovery_v1/second_collection_v1/reports/engine_fidelity_statistics_v2_4_report.md",
        "sha256": "98ee9195b85a27da0e1cea791c2932c156490f1a85b5e06ce9f649c7f5be9c9a"
      }
    ],
    "schema_path": "strategy_discovery_v1/second_collection_v1/schemas/engine_fidelity_recovery_package_v1.schema.json",
    "schema_sha256": "d2c94f1970d1b6daaf6a75603d161aa7d2afbb669e6a0a0aa32cc3293c4de31a"
  },
  "package_canonical_sha256": "fcf677c23199e3e9d4b024bc9ff4a09f0603ede6bc3326ca0815f9bd58119adc",
  "package_id": "strategy_discovery_v1_recovery_package_v1",
  "parent_state": {
    "last_sequence": 904,